{
  "schema_version": 1,
  "rule_id": "set_parameter_request",
  "rule_version": 1,
  "name": "set_parameter_request",
  "scope": { "direction": "A_to_B" },
  "framing": {
    "type": "length_prefixed",
    "length_offset": 2,
    "length_size": 2,
    "byte_order": "big",
    "length_includes_payload": true
  },
  "fields": [
    { "name": "command", "offset": 0, "type": "uint8", "expected": [4] },
    { "name": "flags", "offset": 1, "type": "uint8" },
    { "name": "payload_length", "offset": 2, "type": "uint16", "byte_order": "big" },
    { "name": "parameter_value", "offset": 4, "type": "uint16", "byte_order": "big", "hypothesis": true }
  ]
}
